{
	"RequestId": 1234567890,
	"Operation": "Create",
	"Type": "CreditRunReport",
	"Data": {
		"reportRequest": {
			"Creditnumber": "123485_CM",
			"attributeFormat": "xml",
			"flattenXML": false,
			"parameterNameValues": [
				{
					"item": "P_BU_NAME",
					"values": {
						"item": "SXP Group BU"
					}
				},
				{
					"item": "P_TRX_NUM",
					"values": {
						"item": "CN54321"
					}
				},
				{
					"item": "P_DATE",
					"values": {
						"item": "2021-05-13"
					}
				}
			]
		}
	}
}